{
  "schema_version": "1.0.0",
  "artifact": "release-decision",
  "run_id": "RUN-20260530-210000",
  "generated_at": "2026-05-30T21:30:12+08:00",
  "producer": {
    "agent": "Review Gate Agent",
    "version": "1.0.0"
  },
  "inputs": [
    {
      "artifact": "requirements",
      "path": "docs/contracts/examples/valid/requirements.json",
      "schema_version": "1.0.0"
    },
    {
      "artifact": "requirements-matrix",
      "path": "docs/contracts/examples/valid/requirements-matrix.json",
      "schema_version": "1.0.0"
    },
    {
      "artifact": "design-blueprint",
      "path": "docs/contracts/examples/valid/design-blueprint.json",
      "schema_version": "1.0.0"
    },
    {
      "artifact": "content-blocks",
      "path": "docs/contracts/examples/valid/content-blocks.json",
      "schema_version": "1.0.0"
    },
    {
      "artifact": "diagram-manifest",
      "path": "docs/contracts/examples/valid/diagram-manifest.json",
      "schema_version": "1.0.0"
    }
  ],
  "decision": "approved",
  "allow_word_assembly": true,
  "quality_gates": [
    {
      "gate_id": "G001",
      "name": "必需产物检查",
      "status": "passed",
      "message": "所有必需输入产物均可读取。"
    },
    {
      "gate_id": "G002",
      "name": "覆盖率与评分项响应",
      "status": "passed",
      "message": "需求覆盖 1/1，评分项响应 1/1。"
    },
    {
      "gate_id": "G003",
      "name": "来源 ID 绑定",
      "status": "passed",
      "message": "所有正文与图表均有有效来源 ID。"
    },
    {
      "gate_id": "G004",
      "name": "CONFIRM 与 REVIEW 留痕",
      "status": "passed",
      "message": "确认与复核事项已进入对应清单。"
    },
    {
      "gate_id": "G005",
      "name": "虚构事实与过度承诺",
      "status": "passed",
      "message": "未发现未留痕的高风险事实或过度承诺。"
    },
    {
      "gate_id": "G006",
      "name": "Mermaid 降级渲染标记",
      "status": "passed",
      "message": "未发现未标记的 Mermaid 降级渲染。"
    },
    {
      "gate_id": "G007",
      "name": "图文一致性",
      "status": "passed",
      "message": "图表与正文、设计蓝图来源一致。"
    },
    {
      "gate_id": "G008",
      "name": "占位符残留检查",
      "status": "warning",
      "message": "未提供 placeholder-fill-log.md；本次仅检查内容块中的占位符。"
    }
  ],
  "issues": [],
  "confirm_items": [
    {
      "item_id": "CF001",
      "title": "投标人名称需人工确认。",
      "source": {
        "artifact": "content-blocks.json",
        "id": "CB001"
      },
      "status": "open",
      "note": ""
    }
  ],
  "review_items": [],
  "coverage_summary": {
    "requirements_total": 1,
    "requirements_covered": 1,
    "requirements_uncovered": 0,
    "scoring_items_total": 1,
    "scoring_items_covered": 1,
    "diagram_total": 1,
    "diagram_assembly_allowed": 1
  },
  "next_actions": [
    "Review Gate 已通过，可以进入 Word Layout Agent。"
  ]
}
